{"id": "short_drama", "kind": "genre", "display_zh": "短剧", "display_en": "Short Drama", "source": {"origin": "ai_shortfilm_prompts", "upstream_commit": "5e7c374", "license": "MIT", "absorbed_from": "ai_shortfilm_prompts templates"}, "lens_aspect": {"focal": "35mm medium", "aspect": "9:16", "notes": "竖屏短剧"}, "composition": {"rules": ["portrait format, subject centered or on rule of thirds", "talking head and reaction shot alternation"], "zh": "竖屏构图，主体居中或三分"}, "lighting": {"rules": ["soft key light", "rim light for separation"], "zh": "柔光主光 + 轮廓光"}, "color": {"palette": ["#f5d76e", "#e74c3c", "#3498db", "#2ecc71"], "rules": ["balanced saturated colors", "vibrant but not oversaturated"], "zh": "平衡饱和色彩"}, "motion": {"rules": ["static tripod with occasional push", "handheld for emotional scenes"], "zh": "固定为主偶尔推进"}, "rhythm": {"avg_shot_s": 3.0, "cut_rule": "quick cuts for dialogue, holds for emotion", "zh": "对话快切情感停顿"}, "signature": [{"en": "vertical 9:16 framing optimized for mobile", "zh": "9:16竖屏手机优化", "required": true}, {"en": "dialogue-driven pacing", "zh": "对话驱动节奏", "required": true}], "negative": ["wide landscape framing", "slow pacing", "desaturated"], "fits": ["social media", "mobile-first content", "vertical video"], "avoid": ["cinematic epic", "landscape showcase"], "anime_safe": {"conflict_words": [], "rewrites": {}, "notes": "适配所有画风"}, "vertical_9x16": {"mode": "native", "rules": ["native 9:16 format", "safe area for text overlays"], "note": "原生竖屏格式"}, "grade": {"description": "balanced vibrant grade", "ffmpeg_steps": [{"filter": "eq", "args": "contrast=1.05:saturation=1.10"}]}}