{"id": "wes_anderson", "display_zh": "韦斯·安德森", "display_en": "Wes Anderson", "source": {"origin": "article", "upstream_commit": "24bbcc2", "license": "MIT", "absorbed_from": "mikefluff wes-anderson-symmetric + article"}, "lens_aspect": {"focal": "40-50mm symmetric", "aspect": "1.37:1 (Academy) or 2.39:1", "notes": "中焦正对"}, "composition": {"rules": ["absolute left-right symmetry, subject dead-center", "planimetric front-on face, no dutch", "dollhouse miniature scale feel", "layered front-to-back symmetrical depth"], "zh": "绝对左右对称 + 人物居中 + 娃娃屋平面"}, "lighting": {"rules": ["flat even soft light, no directional shadow", "low contrast pastel bright"], "zh": "柔和均匀光，低反差"}, "color": {"palette": ["#f7c5d4", "#e8b87b", "#a8d8c0", "#92c5e8", "#f4e4c1"], "rules": ["pastel pink / mustard yellow / mint green / sky blue", "high lightness, low contrast", "one color theme per scene"], "zh": "粉红/芥末黄/薄荷绿/天蓝，高明度低反差"}, "motion": {"rules": ["mechanical horizontal track", "90-degree whip pan transition", "overhead flat lay for objects"], "zh": "机械横移 + 90 度转场 + 俯拍平铺"}, "rhythm": {"avg_shot_s": 3.5, "cut_rule": "cut on whip pan / object hand-off / 90-degree turn", "zh": "90 度切"}, "signature": [{"en": "absolute left-right symmetry with centered subject", "zh": "绝对左右对称人物居中", "required": true}, {"en": "pastel pink/mustard/mint/sky-blue palette, high lightness low contrast", "zh": "粉彩高明度低反差", "required": true}, {"en": "mechanical horizontal track and 90-degree whip pan transition", "zh": "机械横移 + 90 度转场", "required": true}], "negative": ["handheld", "asymmetry", "off-center subject", "high contrast dramatic shadow", "desaturated muted palette"], "fits": ["quirky comedy", "stop-motion animation", "storybook whimsy"], "avoid": ["noir", "realist drama", "action thriller"], "anime_safe": {"conflict_words": ["film grain photo", "live-action"], "rewrites": {"dollhouse": "cel-shaded toyhouse"}, "notes": "对称+粉彩+机械横移与平涂动画天然契合"}, "vertical_9x16": {"mode": "letterbox", "rules": ["use a 2.39:1 or 1.37:1 letterbox band in 9:16, centered", "keep subject dead-center on the vertical axis of the band", "subtitle placed in the lower black bar", "for overhead flat-lays: switch to full 9:16 vertical flat-lay (recompose)"], "note": "对称构图适合信箱；俯拍镜头改全 9:16"}, "grade": {"description": "pastel palette, high lightness, low contrast, soft even grade", "ffmpeg_steps": [{"filter": "eq", "args": "contrast=0.90:saturation=1.10:gamma=1.06:brightness=0.04"}, {"filter": "colorbalance", "args": "rs=0.15:gs=0.08:bs=0.10:rm=0.18:gm=0.10:bm=0.15:rh=0.10:gh=0.05:bh=0.10"}, {"filter": "hue", "args": "h=-2:s=1.05"}]}}