{"id": "tarkovsky_slow_meditative", "display_zh": "塔可夫斯基·缓冥想", "display_en": "Andrei Tarkovsky · slow meditative", "source": {"origin": "mikefluff", "upstream_commit": "24bbcc2", "license": "MIT", "absorbed_from": "mikefluff tarkovsky-slow-meditative"}, "lens_aspect": {"focal": "wide anamorphic, deep focus", "aspect": "2.39:1", "notes": "缓冥想"}, "composition": {"rules": ["long take with drifting dolly", "natural light through windows", "earth/fire/water motifs"], "zh": "长镜头漂移 + 自然光 + 元素母题"}, "lighting": {"rules": ["natural light", "sepia monochrome", "soft diffused"], "zh": "自然光 + 棕褐单色"}, "color": {"palette": ["#8b7355", "#a0522d", "#6b8e23", "#2f4f4f"], "rules": ["sepia monochrome", "water/fire/earth tones"], "zh": "棕褐单色"}, "motion": {"rules": ["drifting dolly", "long take", "slow movement"], "zh": "漂移推拉 + 长镜头"}, "rhythm": {"avg_shot_s": 18.0, "cut_rule": "extremely slow, durational", "zh": "极慢持续"}, "signature": [{"en": "long take with drifting dolly and deep focus", "zh": "漂移长镜头深焦", "required": true}, {"en": "sepia monochrome with natural light", "zh": "棕褐单色自然光", "required": true}, {"en": "earth/fire/water elemental motifs", "zh": "元素母题", "required": true}], "negative": ["fast cuts", "saturated colors", "handheld", "modern look"], "fits": ["meditative art film", "philosophical drama", "poetic cinema"], "avoid": ["action", "comedy", "commercial"], "anime_safe": {"conflict_words": ["photorealistic"], "rewrites": {"sepia": "watercolor wash tones"}, "notes": "长镜头+棕褐+元素母题可移植"}, "vertical_9x16": {"mode": "letterbox", "rules": ["2.39 band in 9:16 centered", "motifs span the band", "subtitle lower bar"], "note": "艺术片适合信箱"}, "grade": {"description": "sepia monochrome, soft, slow feel", "ffmpeg_steps": [{"filter": "hue", "args": "h=-15:s=0.55"}, {"filter": "eq", "args": "contrast=0.92:saturation=0.60:gamma=1.04"}, {"filter": "colorbalance", "args": "rs=0.25:gs=0.15:bs=-0.05:rm=0.15:gm=0.10:bm=-0.05"}]}}